,Message,Racism,Sexism
9742,so how much freedom of speech is there in gaza ? and do you jew hating bigots write about that ?,1,0
9749,rt : if we dont ban #islam they will ban us rt : new islamic state video features french ( cont ) http://t.co/3wnmheguhv,1,0
9753,"muslims are not a race , they are a murder cult . http://t.co/czdlhbjyw5",1,0
9754,the apharthide is a muslim thing . they have exterminated jews and christians in most of me .,1,0
9765,and while all other religious groups globally are under genocidal attacks by muslims you blame the jews . utterly stupid .,1,0
9773,"no one ask for your pedophile serving propaganda , swine .",1,0
9774,but the pedophile prophet mohammed only cared about his pecker and his perverted desires .,1,0
9781,rt : #muslim #isis #islam no compulsion in religion . unless you are a kid of course ! http://t.co/va3fbyf6wp http://t.co/b0ajt…,1,0
9785,"and not only did mohammed burn them , the crucified , stoned and beheaded people .",1,0
9792,had nothing to do with islam . mohammed is first wife was a rich merchant before islam .,1,0
9793,it is a guide for nothing . it is islam is claims of the laws of god . and islam is god is a terrorist . islam is prophet too .,1,0
9799,santa just * is * white,1,0
9803,"probably bcus only fools & idiots take seriously the "" blame someone else for terrorism "" industry . islam is to blame .",1,0
9817,i know you have religious police telling how to dress .,1,0
9818,another one of those filthy lies muslims love to tell . this is the truth . http://t.co/ivrtdvh4sx,1,0
9831,keep repeating and believing your brain dead fairy tales - and follow your prophets medical advice . http://t.co/2zo1lqg88v,1,0
9835,i think your goat is calling you . she is horny .,1,0
9854,at that point in time america thought that islam was just a normal religion . now we know that it is a piece of filthy imperialism .,1,0
9856,"yeap , islam is for ignorant butts .",1,0
9862,there is no difference in what the prophet mohammed did and in what isis does .,1,0
9868,"fuck allah , the phony god of islam and terrorism . outlaw #islam now .",1,0
9888,"... she does to the idf , hamas would have put a bullet in her head long ago .",1,0
9901,rt : the islamic organization ( isil ) forcing christian people remaining in mosul to attend sessions for koran conservation http://t…,1,0
9902,"yes , but it smells great now that the daesh rats have run .",1,0
9903,i typed that on there . the hadiths are original . shut up and go look them up . or are you afraid to ?,1,0
9924,the muslims relationship to god is fear . he is told to fear allah again and again in the quran .,1,0
9940,here is a map of israel inside all of the muslim nations that want to destroy israel and murder them . http://t.co/srrwksaqxi,1,0
9965,"love it when these idiot national leaders claim that terrorism has nothing to do with islam , and not one has read the quran .",1,0
9969,"like all such writers , they blab on endlessly as experts without ever having read the quran or hadiths .",1,0
9985,why do you complain ? islam has been ethnic cleansing everybody for 1400 years . is not it time to return the favor ?,1,0
9992,"obviously the driving meme of islam is world domination , if it be by force , intimidation , or persuasion .",1,0
9994,"you are defending the prophet mohammed and he was a murderer , sexist , imperialist and bigot .",1,0
10005,"and you are an obvious liar , because you pick the smallest part of the story to tell your lie with .",1,0
10015,"nobody on the supreme court had a clue about what a murdering , raping , bigoted , pedophile he was .",1,0
10020,when has he ever done anything else ?,1,0
10032,the follower of the pedophile prophet tries to be funny . but the world will outlaw islam soon .,1,0
10048,show me your posts about the christians murdered on blasphemy charges pig .,1,0
10074,"rt : copenhagen : devout muslim who fired on free speech event and synagogue opens fire on police , is killed : “ polic ... http://…",1,0
10081,"rt : at least you are only a tiny bit racist rt : i'm not racist , but my dick is !",1,0
10096,no it does not . islam is grossly sexist . it is a misery for women . http://t.co/oj3ifvg6hc,1,0
10098,"yeap , this is a big problem . the shia militia is only slightly less fanatical and islamofascist than the daesh they are replacing .",1,0
10111,and you ca not use the culture excuse because mohammed claimed to be guided by allah and that he was creating a culture . #islam,1,0
10134,"mohammed later attacked the jews of khybar , slaughtered many and also stole their property .",1,0
10142,mohammed was a murderer who had people killed for disagreeing with him .,1,0
10170,you just proved that you are stupid . i just showed you the hadiths where mohammed calls women stupid and you still deny it .,1,0
10171,my point is that there is nothing that isis does that mohammed did not also do . both are sick and disgusting criminals .,1,0
10181,"rt : australian preacher incites to jihad against the jews : "" they are the most evil creatures of allah "" #australia #islam https …",1,0
10182,... then suddenly their muslim neighbors are persecuting them and stealing their property .,1,0
10183,"saudi cleric : "" sun revolves around the earth . "" now you can understand why madrassa graduates have no skill but jihad . #islam #science",1,0
10192,"before the british showed up , the muslims murdered 80 million hindus .",1,0
10204,here is the quran telling muslim men that they can rape their slave girls . http://t.co/fynapwcbww,1,0
10207,this guy spouted one lie after another and there is no response in this video . just typical lying muslim propaganda . #islam,1,0
10210,there is no personal relationship with creator in islam . everything comes through a phony prophet and the only relationship is fear,1,0
10219,oh please . lecture me about porn when muslims are the worlds biggest porn consumers and islamic heaven is a brothel .,1,0
10222,"rt : #isis has begun recruiting moroccan prostitutes for its militants in syria and #iran , luring them with promises of money …",1,0
10231,"yes , isis defames islam by following it to the letter . http://t.co/donloqygyj",1,0
10245,but look at the reality disconnect . burak says he is for freedom and against all slavery while at the ...,1,0
10248,"the holocaust happened in india , where the muslim scum murdered 80 million hindus , and in africa where they murdered 110 mil .",1,0
10256,the problem is that i have far more knowledge of islam than you and it is your mind that has been shrunken by islam .,1,0
10259,"because of muslim hatred there will soon be no jews , christians , yezidis in me .",1,0
10260,the end result being that the jihadi will be turned into a piece of outdated garbage with zero real world value .,1,0
10280,and there is no jihad and world domination in judaism as there is in islam .,1,0
10289,"i know that they force the same sexism , hatred and bigotry on their population that all islamolunatics do .",1,0
10291,"exactly . read the quran and the hadiths and find out for yourself how hateful , bigoted , sexist , vile and inhuman #islam is .",1,0
10296,but islam hates free speech .,1,0
10299,"well idiot , i see that every native minority in every muslim country is a shrinking minority due to muslim persecution .",1,0
10311,"and i know that umar imposed the code of umar , making jews and christians third class citizens for centuries .",1,0
10317,"in fact , all the things that isis does are the things that the prophet mohammed did in the past .",1,0
10320,muslim bigots constantly create confrontations and then whine to the world about results .,1,0
10326,mohammed stated clearly in the hadith that he wanted muslims to breed like rats so he could take over the world .,1,0
10329,"nobody said anything about jews , racist . we are talking about islam and muslims here .",1,0
10340,"yes , the western world was unaware of the layer of islamolunatics that lived under the thumbs of the dictators .",1,0
10345,the term islamophobe makes as much sense as naziophobe .,1,0
10348,islam is 1000 years of contributing nothing to mankind but murder and hatred .,1,0
10354,you try again . mohammed screwed aisha when she was 9 . http://t.co/gj5ob13hfx,1,0
10362,"eh , they all ostensible follow the ideology of islam . radicals follow closely , others less so .",1,0
10368,and the quran sanctions raping slave girls .,1,0
10388,"all fought against fascist , dictatorial or islamolunatic regimes . for example ...",1,0
10409,"buildings are not as valuable as the men you lost , even if they were rats .",1,0
10410,islam worships a phony nonexistent terrorist god . they would be better off worshiping rocks .,1,0
10413,at least i do not follow pedophile prophets or believe in mythical creatures of fire called jinn .,1,0
10434,regarding slavery . the slaves in america were initially sold by muslim slavers . christians got rid of slavery on their own .,1,0
10437,99 % of the time you muslims play the victim card it is a lie and the reverse is true . http://t.co/xqxxq4wdho,1,0
10438,"any achievements by jews in spain was despite islam , not because of it .",1,0
10440,rt : the terrorists themselves trumpet their allegiance to allah and their religion . it is stupid to pretend away …,1,0
10441,"wrong , microbrain , she was 6 , and you , like your prophet , are a liar . here is the proof http://t.co/q95ei17sua",1,0
10443,the difference between judism and islam is no foundation in jihad in judaism .,1,0
10452,"you dumb asshole , he legalized slavery , he raped slave girls , he was a pedophile . how can you call him great anything .",1,0
10454,rt : #us muslim holiday ‘ honored ’ by conn . school district includes animal sacrifice by beheadings http://t.co/g81rdr5ajt ht …,1,0
10457,"all westerners did not subscribe to nazi ideology . all muslims subscribe to the religion of hatered , murder , and bigotry",1,0
10467,mohammed was a rapist who raped young girls and approved of the rape of slaves .,1,0
10477,"yeah , break relations with the only me democracy that the muslims are trying to exterminate . smart .",1,0
10479,who cares . isis does what mohammed did . tens of thousands also do and have joined him . muslims crazy . http://t.co/jxky2pdj93,1,0
10481,look at this ranting lunatic palestinian . interesting what he tells us . https://t.co/8cmfoozwxz,1,0
10495,"when the filthy daesh set off ieds in baghdad , they do not care if none of the victims are armed.you are a hypocrite",1,0
10501,the religion of islam is built on apartheid and ethnic cleansing .,1,0
10511,mohammed raped women . jesus did not . mohammed had people murdered . jesus did not .,1,0
10517,the fact that i have a brain prevents me from accepting islam .,1,0
10525,rt : to allow muslims to pervert our us constitutional rights via domestic mosques and islam teaching is outrageous . #banislam # c …,1,0
10529,hey should not you be worrying more about pakistan muslims murdering christians & hindus ?,1,0
10540,islamophobia is like naziphobia . there is no such thing .,1,0
10544,in the quran islam declared war on all mankind 1400 years ago . it is time for humanity to return the favor .,1,0
10547,"having read the quran and hadiths , i discovered that islam is a murderous , bigoted , sexist , hate mongering cult .",1,0
10559,"i saw the report , and i have seen other reports of shia crimes . but i have not yet seen evidence of it for tikrit .",1,0
10564,choudary tells the truth about islam . islam has no spirituality . it is only about forcing the world to obey . https://t.co/suzmc5aler,1,0
10572,and the israelis are fighting no one except the muslim terrorist .,1,0
10574,islamophobia - fear of this . http://t.co/6nqtuxhw36,1,0
10582,here is the quran telling women not to leave their house . http://t.co/klxiwzf7md,1,0
10594,so now you admit that the quran sanctifies sexual slavery and try to change the subject .,1,0
10599,"by now no one buys that "" few individuals "" lie any more . most muslims are extremists . http://t.co/kfxzxkfqso",1,0
10621,the prophet mohammed beheaded 600 jews for not being loyal to him . and all the muslims love mohammed . so what is the problem ?,1,0
10634,"the quran spend 1/3 of it is space hating on "" unbelievers "" . that is hard to put aside . http://t.co/fq99v6siyg",1,0
10637,"again , look at this chart and tell me were you get the "" a few "" idea . http://t.co/qsttdz57vj",1,0
10663,islam does not answer anything . it pretends to answer with illogical and delusional superstition .,1,0
10668,"so they blow up statues and churches and attack civilians because it is all they can do as they "" die in their rage "" .",1,0
10689,"and looking at your page , i can see that you are in the business of photoshopping images , islamist cocksucker .",1,0
10703,israel is only trying to defend itself against murderous muslims trying to wipe it out . un votes by muslim nations mean nothing .,1,0
10705,most of the african slaves were slaves of muslims .,1,0
10707,"and what are the muslim scholars going to do ? say , "" you caught us , our religion is violent and barbaric """,1,0
10713,and no one is entitled to a belief that denies other people their believes . http://t.co/pli8wepbsf,1,0
10720,no it is the muslims that have done the ethnic cleansing for 1400 years . israel is putting a stop to it,1,0
10723,"considering what those "" local arabs "" did to kurds , christians , assyrians , ezidiz , etc . , who cares .",1,0
10730,"rt : read it liberals & get a reality check on life ! within islam your views , beliefs , any democracy system , mean nothing ! http …",1,0
10737,islam is at war with every other religion and non religion on the planet . but idiots claim the fault is the jews .,1,0
10749,"a word of advice , until you can show that wikiislam is false , do not bother me with your advice .",1,0
10750,it is fair if the religion itself is extremist and if most of it is followers subscribe to what the religion invokes .,1,0
10751,rt : arab slave trade : 140 to 200 million non-muslim slaves from all colors and nationalities - still happening today ! http://t…,1,0
10777,i read the quran and the hadiths . disgusting and inhuman .,1,0
10784,"you must have found it in your imagination , because it does not exist in islam .",1,0
10797,muslims are fighting with every religion and none religion on the face of the earth . but we are suppose to believe it is jews fault,1,0
10811,has blumenthal ever written about all the pakistani hindus & christians murdered by muslims http://t.co/ylflnnfwbh,1,0
10813,hard to get stupider than you . still no change in ratios justified by anything israel did .,1,0
10824,"yes , all of the land the muslims have they got by butchering the inhabitants . and they are depraved psychopaths .",1,0
10838,israel is zero threat to world peace . every muslim nation on the planet is a threat to world peace . http://t.co/nybrn19xat,1,0
10868,again you are the liar . muslims invaded europe 400 years before the crusades .,1,0
10872,"rt : eric holder from #ferguson : "" i understand that mistrust . i am the attorney general , but i am also a black man "" http://t…",1,0
10885,the prophet mohammed also had people murdered that spoke against him .,1,0
10897,71 christian churches looted and burned by muslim mobs . http://t.co/xeglofsnwj,1,0
10909,"rt : some people work very hard to make this world a better place , while others work very hard to book a drink and sex party in t …",1,0
10924,"the rapist represent islam because it is approved in the quran and hadiths , microbrain .",1,0
10933,muslims are trying hard to finish the job of genocide that their prophet mohammed gave them #islam #israel #palestine http://t.co/grfvglmi70,1,0
10937,islam is about as perfect as nazism .,1,0
10938,"rt : in the wake of the #parisshooting it pisses me off to hear politicians , celebrities & the like , trying to lessen islam is role …",1,0
10957,because christianity is dying out and the christian world has reformed itself .,1,0
10962,look at the size of israel . and yet muslims are slavering to destroy it . http://t.co/v8ev7d61ea,1,0
10967,"blumenthal fights for palestine which has no freedom of speech , has honor killings , and beheads gays .",1,0
10970,"if you do not want to read a pedo , you have to stop reading the quran .",1,0
10972,and hamas trains child soldiers and sends them to get killed for propaganda . http://t.co/naoje5oqwo,1,0
10977,"dumb muslims complain about freedom of speech and support blasphemy laws at the same time . what a disgusting , inhuman religion .",1,0
10982,is that suppose to be some kind of stupid excuse for the barbarity of the shia militia ?,1,0
10989,"yes , the quran tells muslims to murder people of other religions . http://t.co/eexrtv2bjx",1,0
10999,"look at the data , dipwad , 1/3 think that people who leave islam should be killed . http://t.co/mftot9ijty",1,0
11003,what does isis do that the prophet mohammed did not also do ?,1,0
11005,i hope they just outlaw the vile religion of islam entirely . they should have done it 30 years ago .,1,0
11007,this guy is a muslim who is lying mohammed . there are 7 hadith that clearly and explicitly state that aisha was 6 when married .,1,0
11020,good . by marching on israeli checkpoint the women were obviously trying to create a confrontation .,1,0
11022,why not . muslims have practically exterminated every non muslim minority in mus countries .,1,0
11029,"since islam has already declared war on mankind , mankind needs to declare war back on islam .",1,0
11044,isis beheads people because mohammed beheaded 600 jews in one day .,1,0
11068,"no , the problem of the palestinians and all muslims is that they cannot stand for a jewish state to exist on the peninsula .",1,0
11074,"anything an american does defines america , anything a muslim does is an aberration ? idiot !",1,0
11075,"when an islamolunatic blows himself up in baghdad , it has zero to do with bush and blair .",1,0
11082,sharia law is far more evil than outlawing a few vices . here . #islam http://t.co/vjtyjzleeg,1,0
11091,all the christians and ezidis that are told to leave or convert or die are forced .,1,0
11095,blumenthal self promotion . the only groups that attack talks and kill people are max is terrorist muslim friends .,1,0
11106,you should be attacking everyone that follows a religious cult of hated and murder like islam .,1,0
11114,"rt : sssshhh ! the silent muslim majority , remains quiet . http://t.co/y2ylddw8qt",1,0
11131,why do nearly half of all muslims want to kill people for who they have sex with ? http://t.co/wzmsfrj70n,1,0
11132,"considering the endless stream of murders against minorities by muslims , who cares .",1,0
11137,rofl . in your dreams daeshbag .,1,0
11138,and if you are over 12 you will have to go and die for baghdadi next week .,1,0
11150,"like a bunch of mindless bots , muslims repeat the same lies in exactly the same words , every day , multiple times a day .",1,0
11152,"rt : dangerous to outsource iraq security to shia militia known for "" disappearances "" & executions . http://t.co/3catmb5vzl http://t.…",1,0
11171,tell it to the 120 million africans that islam murdered . https://t.co/xwjzpsodgj,1,0
11178,objecting to this is what the pc morons of salon call racism . http://t.co/pepfxllkfu,1,0
11192,all of islam is blinded by hatred . the religion was built on hatred and intimidation . http://t.co/jpqolzjrgi,1,0
11203,"the lesson the world learned about islam is that when we get rid of their brutal dictators , they are replaced by brutal islamists",1,0
11213,ca not expect honesty from people who follow a caravan robber .,1,0
11214,rt : #isisaremuslims #banislam #islamisevil #islamistheproblem http://t.co/ufcm2jntab,1,0
11220,"again , why should not everybody hate islam ?",1,0
11236,do you think that the brick heads at salon know that the prophet mohammed beheaded people in mass ? #islam,1,0
11237,"the myth of "" moderate "" islamic rebels . they are all fanatics and #islam must be outlawed . http://t.co/bygcwwqjw5",1,0
11238,"until we get beyond making excuses for , "" just a few bad muslims "" and recognize islam as a religion of terror , paris will keep happening .",1,0
11259,"yes , all that islam is making isis so loving . idiot ! http://t.co/qjxds8fmyw",1,0
11284,rt : the next successor to the saudi throne will be the son of a slave girl http://t.co/c1xmxltlxq http://t.co/wtdeboe1ha,1,0
11295,laugh all you want . islam is a steaming pile of shit . good night . blocked .,1,0
11302,"if you want to understand the lie of muslims living in peace with jews , read ibn warraq http://t.co/kfsbdefykd",1,0
11310,you muslims should kiss our ass for buying your oil . if we did not you would be riding camels and the population of the me would be 1/3,1,0
11311,"isis practices slavery and rape , mohamed practiced slavery and rape .",1,0
11317,"it already is a war . islam has been at war for 1400 years . ignorant , cowardly people try to hide from the fact",1,0
11319,wheras islam simply declared war on all humanity 1400 years ago and has never stopped . time to return the favor,1,0
11323,human rights record of animals living in palestine . http://t.co/qjcii9wcwi,1,0
11328,no the lies that i tell come directly from the quran and hadiths . like declaration of war on humanity http://t.co/oc5y5cb740,1,0
11355,i hate islam because it is a religion based on hatred and jihad . http://t.co/n60i1tfxhw,1,0
11358,rt : islamic terrorists are only practicing what is taught in islam.that is the truth and the ' elephant ' in the room which ev …,1,0
11379,muslim people insult themselves by the vile religion they follow and their extremism . http://t.co/hrzcwdcjln,1,0
11387,why does it not occur to you that only an idiot would imagine a god who wants to be feared .,1,0
11394,the quran approves of the beating of women and tells them to stay home . so isis does it also . http://t.co/0jzqklpyyh,1,0
11395,perish slowly my ass . slavery lasted longer in the muslim world that anywhere else . and your hero is trying to bring it back .,1,0
11399,here are churchill is views about the pedophile prophet . http://t.co/tx7lhgnwf7,1,0
11401,the reason that is newsworthy is because the muslim contribution is so much more often destructive .,1,0
11404,which is why they win 95 % of all nobel prizes and create all the technology that muslims use and were too stupid to invent .,1,0
11411,"rt : obamas * moderate * pals : syrian rebel sharia enforcers storm wedding party , arrest 17 for listening to music http://t.co/msnffefm…",1,0
11413,"if someone is going to die getting isis out of #tikrit , it may as well be the shia militia . that is all good . #islam #daesh",1,0
11417,"where they live tells you everything you need to know , namely , that islam is a religion of bigotry",1,0
11420,isis follows the quran and hadiths exactly . they follow the sunnah exactly . the evil is in the quran and hadiths .,1,0
11436,but the western world gave up slavery on it is own . no one forced them from the outside .,1,0
11442,"and since islam is a religion of murder , bigotry and hatred , hating islam is rational . http://t.co/yvomfk1ytk",1,0
11463,"if you want to ignore the mountain of data that shows islam to be a pile of crap , that is your prob",1,0
11466,mohammed was a sexist who abused women . isis are all sexists and abuse women .,1,0
11470,the muslims have exterminated virtually every minority in the me and these idiots talk about israeli aparthide .,1,0
11475,"actually , they follow the quran and the hadiths exactly . it is the "" moderate muslims "" who ignore much of their canon .",1,0
11497,the hatred against jews and christians and others was begun by mohammed . http://t.co/fbflcfdlu8,1,0
11514,mohammed declared a jihad against all non believers . isis is executing a jihad against non believers .,1,0
11521,raping 9 year old girls is allowed in islam . so where are child soldiers outlawed ?,1,0
11537,"a good muslim is good despite his bad religion , not because of it .",1,0
11541,most countries are moving in that direction . but not muslim ones . http://t.co/t65iytpvdk,1,0
11545,so of course muslims are caught in a corner having to make conspiracy theories to try to protect islam .,1,0
11589,"they claim , "" oh you insulted our religion "" and kill them .",1,0
11590,"again you are an idiot . "" others did bad things , so we have to ignore the barbarity of islam , """,1,0
11591,"mohammed owned slaves , jesus did not . mohammed robbed caravans . jesus did not .",1,0
11605,"again , you talk like an idiot . i have no religion and what you say changes nothing about muslims being extremists .",1,0
11610,and muslims never progress . they are still barbaric . http://t.co/mw2fgivrkk,1,0
11612,when muslims try to defend their prophet against pedophelia they never tell you about the proof that he was a pedo . http://t.co/19rsg7nhah,1,0
11638,isis beheads people . saudi beheads people . mohammed beheaded 600 jews .,1,0
11659,"and now , every jihadi group wants to reinstate slavery in the present because the quran approves it and mohammed practiced .",1,0
11671,"gee , last week it was the nazis , this week the zionists , next week the martians . never has such a fool used the buddha .",1,0
11679,the muslim citizens of raqqa enjoying a peaceful day of beating three men to death . http://t.co/ki4tdl3idr,1,0
11690,""" dens of apostates "" ? murder for the sake of religion . could you get any more stupid and inhuman ?",1,0
11692,"the muslims think that lying is the greatest of all virtues , after genocide .",1,0
11708,proof mohammed was a pedophile . http://t.co/bzct7z9adc,1,0
