,Message,Racism,Sexism
2316,b'i will take that as you saying yes its ok for him to hit her in the same way,0,1
2318,b'i think it was nikki and katie is modesty that made them so appealing mkr,0,1
2325,b'celine is not funny stop it mkr,0,1
2327,b'women have more legal rights in every western nation who is privileged,0,1
2336,b' ok im not sexist but no one gives a flying fuck about womens football,0,1
2342,b' ah you are a feminist seeing sexism everywhere then do check my tweets before you call me sexist yo …,0,1
2343,b'so hilarious u write ur own material a lot of ppl call me sexist but those ppl are women and their opinions do not matter,0,1
2352,b'nope im not sexist but only dudes should be busting ghosts ghostbusters,0,1
2364,b' im not sexist or anything but i do not take female rappers seriously i would never buy a nicky minaj album or something,0,1
2378,b' where the women should be notsexist justfunny httptcopdfuivuyg,0,1
2384,b' the reality is that the caliphate is more attractive than your ultraliberal safe space and that is too embarrassing to …,0,1
2388,b'im trying so hard to be charming annie i have nothing to add mkr,0,1
2394,b' the promo girls should be on cigarette packets smiling then everyone would quit mkr,0,1
2398,b'and whose definition is that anyway margaret sanger is,0,1
2403,b'ca not wait till you get locked up im not sexist so im not afraid to hit a girl in fact i plan on it,0,1
2413,b'male action movies ehhhh not sexist but female action movies ehhhh,0,1
2419,b'wow rt yip im not sexist but i would like to throttle that woman,0,1
2431,b'shorter anyone who does not agree with you that women should be legally prohibited from driving is sexist outrage,0,1
2432,b' im not sexist but most women today will take up all the best seat in the pubs clubs when they have no clue what is going on …,0,1
2449,b' questionsformen did you know that when you look at a girl you rape her httptcoglplasoa,0,1
2453,b'oh shit he was the one you can call me sexist if you want but if you ca not cook you become less attractive,0,1
2457,b' rt katie and nikki are frkn annoying stfu mkr you are not even hot lol stop rt vidhttp tcocrzopy,0,1
2458,b'with a flat face the nose a bay window,0,1
2468,b'refined pretty looks like something a blind kindergarten student chucked on a plate mkr,0,1
2476,b' girls playing football in a park with no guys just looks somewhat unnatural notsexist observations,0,1
2482,b' mensrights reddit httptcovoffuhmnas petition to call attention to judge kathleen mccar httptcotjltpfdn …,0,1
2483,b' im not sexist but women should not commentate on the football it just does not sound right,0,1
2484,b'it took the priest a year to convince her to tell the cops he served years out of she got months,0,1
2488,b'shutup about the sass read some cookery books you twit mkr,0,1
2493,b'possible,0,1
2496,b'fuck me i hate kat if she does not leave i swear mkr,0,1
2504,b' but a girl doesnt run as fast as a boy likeagirl so focus on what she can do like get pregnant and glorify motherhood …,0,1
2514,b'that girl is hideous in every way,0,1
2516,b'kat is the daughter of satan mkr,0,1
2517,b'yes really and no one cares about you ahahahahah im not sexist but a new ghostbusters movie with a female cast really,0,1
2521,b'actually nikki really is quite good looking wait till my shots hit the newstand mkr photography fashion,0,1
2523,b' the para is here are the elite of the british army most applicants fail p company im not sexist but women will nev …,0,1
2525,b'no doubt but talk about projection first two sentences describe feminism perfectly no self awareness feminismisawful,0,1
2526,b'so you oppose equal gender rights do you,0,1
2531,b'kat has absolutely no shame she should be ashamed her children will one day see how childish her mouth acted mkr killerblondes,0,1
2532,b'scoring like a cunt because you ca not cook for shit is not fighting hard kat you stupid mole mkr,0,1
2536,b'who was responsible for convincing these girls they were so pretty mkr,0,1
2543,b' im not sexist but i believe in my kids having parent home being fully parented,0,1
2544,b' this person thinks there is no wage gap 😒 smh “ no you commies here is why httptcoqoumhohj…,0,1
2545,b'hope one of those bitches falls over and breaks her leg mkr,0,1
2549,b' most of you girls should just go out without make up that is probably scary af,0,1
2552,b' woman rips off man ’ s testicle because he rejected her tried to swallow it httptcospmvzcjjo questionsformen askgoog …,0,1
2562,b' im not sexist at all but i can not stand female reporters in men is sports,0,1
2566,b'why is a man afraid to commit to woman he really loves questionsformen sexist biased divorce laws will ruin his life,0,1
2570,b'no idea i just collect them randomly as i find them,0,1
2571,b'referring to ret d drivers to boot worrrrrrd especially middle aged women notsexist truthdoe,0,1
2573,b'there just horrible lemontarts mkr,0,1
2575,b' no sexist but i like how arya is a boy now yet she is washing dishes still lol got,0,1
2579,b'lol call me sexist but i really hate girl gamer teams really really hate lol,0,1
2590,b' call me sexist if u want im a man and men do not reallllly listen to women when they speak,0,1
2599,b'cuntandandre cuntandandre cuntandandre mkr biggest flogs the show has ever had on it ever cantcook fuckoff katandandre,0,1
2607,b'i determined you are not worth such an effort deal,0,1
2608,b' usually do not watch female led movies but when it is scarlett johansson sole gonna havtoo hahaha notsexist,0,1
2610,b' women should not participate in no shave november it should be legal for them ai not no guy want a hairy chewbacca women,0,1
2612,b' oh somebody posted the link to the source of the story about the feminist who aborted her baby because it was a boy http …,0,1
2625,b'whyyyyyy 😩 i just want these dumb bitches gone mkr,0,1
2626,b' nope im not sexist but i think the doctor should stick with a male,0,1
2633,b'yeah like not start wars im no sexist but there are some things women do that men just wo not,0,1
2636,b'turing test failed not sexist but america will not be taken seriously if we have hillary clinton becomes president,0,1
2639,b' im not sexist or anything so i hope no single broad try to swerve me but a woman is ultimate position is to be by a man …,0,1
2651,b' pretty sure that gamergate episode of law and order is basically the new reefer madness holy actual fuck this exists,0,1
2656,b' im not sexist but i truly believe that women cannot drive idefk why the hell they ca not but they are deadly behi …,0,1
2657,b' just seen a comment on how chivalry is rarely practiced by females im not sexist but that is irrationality at it is finest,0,1
2663,b' im not sexist but i stand by chris paul the woman ref made a bad call and could not take the scrutiny part of her job,0,1
2667,b' im not sexist but women cannot drive lifefacts,0,1
2670,b' tbh you can call me sexist but the sight of girls smoking is unpleasant,0,1
2683,b' women is tennis is of a good standard shitnoonesays notsexist stillenjoywatchingivanovic,0,1
2686,b' and no im not sexist but a bitch is a bitch,0,1
2688,b'got a st for coburn more than i would have thought hawks made a mistake took big risk on timonen but good deal for hextall,0,1
2698,b'for life yes,0,1
2699,b'feminists started feministsareugly take it up with them,0,1
2701,b'anything but yourself like every feminist on earth,0,1
2702,b' i hope im not sexist but why do women love to argue with me and have the last word then laugh it off this shit is serious,0,1
2708,b'not bitches just you,0,1
2714,b'sorry just checked your tl i thought you were arguing in concert w this genius httptcocsepnxse,0,1
2717,b'should women be united or honest,0,1
2726,b' not sexist but females should not talk sports that is like me talking about a new designer purse or something clueless,0,1
2727,b' now im not sexist but it is evident a woman ca not do a mans job when it comes to tennis coaching mauresmoout,0,1
2735,b' the democratic people is republic of korea must be a wonderful place right look up the words,0,1
2759,b'he was also just existing no,0,1
2771,b' call me sexist but i preferred cod without this stupid chick,0,1
2773,b' call me sexist but i do not think i wanna see a women president at this stage in my life,0,1
2778,b'maybe you could live on mars and help us all out im not sexist but if i hear a woman is voice on the radio i turn it,0,1
2789,b' call me sexist but if you need a specific training segment for coaching women it defeats the purpose of equality across …,0,1
2794,b'prison is the same except with more prison time,0,1
2795,b'using it to communicate our humanity chicks man do not call me sexist because we all know how yall girls are with twitter,0,1
2798,b' notsexist but is erin andrews the most average looking super talked about as a hottie ever totally fine sports re …,0,1
2805,b' i guess i would be a safer driver too if i did ten under the speed limit not trying to be mean,0,1
2808,b' call me sexist or whatever but if ur my gf woman wife keeping the house exception our room laundry folding clothes is a m …,0,1
2815,b' did anybody get glass in the face during an american sniper showing these fiftyshades fans play for keeps,0,1
2818,b' im not sexist but also definitely not a fan of the rumour of ghostbusters with women what next steel magnolias with d …,0,1
2819,b'nope,0,1
2820,b'i did not realize i was supposed to treat you as a child whose opinion is irrelevant sorry my bad,0,1
2826,b' im not sexist but i must admit the women belong in the kitchen jokes were worth a chuckle,0,1
2833,b'barb sheehan never says a word about being abused for years kills husband claims abuse w no proof walks fems cheer,0,1
2837,b'please tell me cuntandandre go to sudden death tonight cantcook cuntcook mkr wontstoptilltheydrop,0,1
2838,b' depends on their costume am not sexist but can women league football ever get the kind of attention the m …,0,1
2841,b' and one that his law firm previously sponsored told him that he need not send in a check this year wow,0,1
2842,b' eeuww i do not want to fit anything into their little boxes,0,1
2843,b'you say this based on what,0,1
2844,b'men should men dumb women call me sexist real ladies respect the traditional values men should men and women should be women,0,1
2845,b'kat can fuck off home now mkr,0,1
2846,b'if katie and nikki are models i will eat my hat mkr,0,1
2848,b' im not sexist but everything seems to be about women women this women that hayi khona anikahle,0,1
2852,b' that woman reporter on soccer saturday has not got a clue annoying notsexist thetruth,0,1
2857,b'how is that sexist,0,1
2858,b'what does the on the dollar figure describe,0,1
2860,b'hashtag notsexist but a womans ill be ready in minutes is the same length of time as a mans ill be home in minutes,0,1
2863,b' call me sexist but it really pisses me off when girls who know fuck all about football win huge bets womenagainstfeminis …,0,1
2867,b'feminism,0,1
2869,b'most democrats now avoid liberal like it is diseased stop propping up feminism w credit for the women is rights movement,0,1
2879,b' call me sexist or whatever but all they wanna do is be heard and that is cool too but damn cmon nah,0,1
2893,b'hey fuck you everyone saying germany are unreal they are being helped by playing against year old girls notsexist,0,1
2894,b'i agree i can just spot them early i was right about gaga,0,1
2897,b'i see your maturity level has remained at the same level as then not sexist but the last thing a woman changed in me is diapers,0,1
2904,b'no because math is hard two and two does not make five you know that right,0,1
2906,b' what the hell man making thor a woman is like making spiderman a woman im not sexist but you just do not do certain things,0,1
2910,b' these nsw promo girls think way too highly of themselves they are not even attractive 😳 mkr mkr,0,1
2911,b'no feminism opposes choice of parenthood via financial abortion for men,0,1
2913,b' ladies i do not think that you ca not drive i just know that you ca not park or back out of a parking space facts notsex …,0,1
2924,b'and for dessert a dropped pie like katie is face mkr mkr,0,1
2929,b' im not sexist but an allfemale ghostbusters is going to be just awful,0,1
2932,b' if you are a grown woman who has not gotten past your awkward teenage years of confusion and angst you are probably a feminist,0,1
2937,b' retweet if you hate ovechkin fav if you hate ovechkin hate ovechkin,0,1
2948,b'be a man stop babbling and squirming and admit you were wrong,0,1
2953,b' im not sexist but the vast majority of women i know are pure evil,0,1
2969,b'i need a meme of that that is my day in a nutshell,0,1
2970,b' so let me get this straight who weaponised tweets to have people fired is now a victim of twitter http …,0,1
2976,b'honestly no idea what that is,0,1
2977,b'do you get it you blondes mkr,0,1
2982,b'is saying that sexism,0,1
2983,b'ahem httptcoxdicmjhbo,0,1
2985,b'fuck off forever dickweed women ca not park notsexist fact,0,1
2997,b'just felt the need express this some reason do not get me wrong im not sexist but seeing female engineers on site is weird,0,1
3004,b'kat change your face fuckerface mkr,0,1
3005,b' you do not understand my intent,0,1
3007,b' yes i tell cops that a star trek actor a jeopardy winner a vikings washout are trolling everyone but they do nothing …,0,1
3009,b' im not sexist in the slightest but women comedians should not be allowed they are not funny at all,0,1
3010,b' people are too damn sensitive lol,0,1
3012,b'but sorry who cares that the national organization of women was commie you were talking about a trucker right too funny,0,1
3015,b'like if gamergate really just hated women why bother with gg need no permission to hate they could just hate play games,0,1
3016,b' the truth behind another elimination round to get rid of cuntandandre mkr,0,1
3025,b' call me sexist but the true definition of a goddess is a good house wife mother who also has good health looks and physique,0,1
3027,b'kat the villian but pulling off that red dress mkr httptcomxdshz,0,1
3028,b'the face of very ugly promo girls faces like cats arsehole mkr excited to see them go down tonight literally httptcohgojrfoieo,0,1
3043,b' im not sexist but what ferrari was it a red one,0,1
3046,b'not concerned w equal here httptcodokgsrlg,0,1
3052,b' im not sexist but cut it out with the whole sideline reporter nonsense they are absolutely useless and take away from …,0,1
3058,b'did you hear that ladies start catering to his every whim i swear im not sexist but some of you females tempt me,0,1
3064,b'lol omg call me sexist but i do not respect anything a girl has to say about football or sports itself lol,0,1
3068,b'oh shit now we have to put up with freaking kat and no balls andre for another week fmd mkr,0,1
3069,b'youre so popular just snapchatted every girl in my phone and told them to make me dinner lol notsexist,0,1
3071,b'boooring am not sexist but women ca not play football,0,1
3074,b' not sexist but i cant have a woman discussing rugby league if its ladies ruby league fine not pc so save any potent …,0,1
3075,b'you are also ableist and a damn waste call me sexist idc but when girls fight your argument just sounds retarded,0,1
3081,b' im not sexist but a lot of yall females really ai not good for shit except catching semen,0,1
3096,b' am not sexist but most woman ca not drive no offence girls your the best at everything else tho,0,1
3100,b' the most they do is say ca not believe so many dudebros are protesting malesuicide,0,1
3108,b' im not sexist but the men is skill sets and abilities are just leagues above the women is much more entertaining olympics,0,1
3115,b'httptcozjbwagvnrg and im not sexist but some of these yesallwomen posts are just the most dumbest things on twitter,0,1
3118,b'im nervous for annie kat is gonna tear her a new arsehole if she stays on the show mkr,0,1
3122,b'a misogynist a woman wants her man to treat her like a princess to the world and fuck her like a whore someone,0,1
3125,b'too much drinking too many porn stars then they end up winning in la should have given them more drinks porn stars,0,1
3133,b'you too,0,1
3139,b'two blondes twitter will be the judge of hot mkr,0,1
3143,b'so you are sexist and have no taste call me sexist but i have no desire to see a stand alone wonder woman movie,0,1
3149,b'they do not care each day i realize feminists are perfectly happy to ruin anyone else is life for their gain,0,1
3152,b' call me sexist if you would like but i just cannot watch women is hockey so boring,0,1
3154,b' im not sexist but women are responsible for childhood obesity,0,1
3160,b'yup there still hot blondes mkr,0,1
3164,b'middleinformer rt benpobjie credit to kat she puts a hell of a lot more effort into badmouthing others than she does her cooking mkr,0,1
3168,b'rofl i just looked at who you follow and i see three of oktar is bimbos on your list yeap i can always smell an oktar zombie,0,1
3169,b' im not sexist but i have seen pieces of the most dreadful driving this morning in this garage everytime it is been a w …,0,1
3170,b'there is literally photo evidence above,0,1
3174,b'colin likes moist thighs preferably of the promo type mkr,0,1
3179,b'so i got the rigging part right but not the scouting,0,1
3180,b' did you find katie and nikki in the line for mt druitt is next top model mkr,0,1
3187,b'because of fucking inane male opinions like this one why are girls just mad at the world for no reason notsexist,0,1
3192,b' go hot girls mkr,0,1
3202,b'maybe you do not like it that much id like to consider myself open minded and not sexist but female ufc what in the fuck,0,1
3207,b'or grab a camera,0,1
3211,b' every guy knows that the only thing that will make a woman happy is making any man a sandwich notsexist,0,1
3215,b'yes i find the sense of proportional relevance interesting,0,1
3219,b' iam not sexist but y do women have the singular ability block the way coz the r busy texting make me miss my train y dont u,0,1
3226,b' this lady is a terrible official not because she is a lady though im not sexist but because she is a stupid bitch cavs,0,1
3229,b'are you kidding me these girls on mkr did not cook their own tomatoes or peppers,0,1
3239,b'um i m not sexist but there are somethings girls just shouldnt do,0,1
3243,b' call me sexist but should not everyone on the panel have either played or coached at the collegiate level,0,1
3244,b' ur gonna put this guys fate in the hands of fat dickless hurtin un american ungrateful women i mean im not sexist but …,0,1
3248,b'its melting because you didnt put it in the freezer before you served it you dumb skank mkr,0,1
3255,b' driverless cars that would be an improvement for some of the clowns on the road notsexist,0,1
3274,b' i remember when i used to refuse to get on the bus if a woman was driving it notsexist,0,1
3284,b' oh snap here is what w from world countries think abt ppl like you questionsformen http …,0,1
3288,b' guys be better then women in everything not sexist but it is just coz we are competitive as hell,0,1
3303,b'mkr mkr i do not think these girls can cook also pls stop the duck face,0,1
3304,b'not to mention these same girls on mkr have super inflated egos considering they did not cook that well and are not very nice,0,1
3307,b' hey i have a gender studies degree clearly you all are the brainwashed ones,0,1
3315,b'kate you stupid woman mkr,0,1
3329,b' im no sexist but the last thing i wanna read about is women is football or cricket on the sky sports news app controve …,0,1
3335,b'tell me more i dont think girls should do no shave november,0,1
3347,b'cant believe the blonde bimboz made it throughthat sausage looked like feces mkr,0,1
3352,b' has a female comedian ever made anyone laugh ever call me sexist but women comedians are not funny,0,1
3356,b'question is are they pretty mkr,0,1
3363,b' im not sexist but females have no business commentating football it is like a man conducting a child birthing class just d …,0,1
3365,b'how unfortunate that no one cares what you think im not sexist but football ai not meant for women,0,1
3367,b'exactly a well executed rebuild but do not rewrite history we tanked for fleury geno sid was gary rigging the lockout draft,0,1
3380,b'separate conversations she told a guy concerned about circumcision that he ca not get laid exactly what she whined about,0,1
3382,b'do not count any chickens most of the gop candidates suck and could well lose to uneducated history vagina voters,0,1
3383,b' im not sexist but i do not really fw female rappers,0,1
3386,b'so is twat,0,1
3390,b' the people at work are childish lol its run by women im not sexist but when women dont agree to something oh man …,0,1
3393,b'i am amused greatly by the redscarebot,0,1
3394,b'if cuntandandre make it through i will i do not know what i will do mkr,0,1
3396,b'haha what call me sexist but i still do not like how the main character of legend of korra is a woman it just does not feel right,0,1
3398,b' cause you are just as wrong as them but want rights at the end of the day im no sexist but im not for fem …,0,1
3403,b' im not sexist but i find it really weird seeing a woman sing in a band full of guys,0,1
3404,b'good for you too bad about those hurt by it or unprotected by it right,0,1
3409,b' im not sexist but i dont think girls are funny,0,1
3421,b' im not sexist but let is face it girls ca not drive,0,1
3422,b'just my guess it is now in my tweets as proof if it comes true i knew he would rig the draft so the avs could get seth jones,0,1
3424,b' females need to stop thinking that they will be treated exactly the same as males society wont let it happen factsoflife n …,0,1
3428,b'walker is clearly the one dems fear i do not know much about him either,0,1
3430,b'ok so im not the biggest fan of the blondes but even i did not want them to go mkr,0,1
3431,b' women comedians suck notsexist disappointed,0,1
3436,b' richard petty was right if danica patrick was a male no one would know she was on the race track notsexist daytona,0,1
3437,b'i saw this the other day excellent,0,1
3439,b'kat and andre should not be there they suck dick holes the moles win my vote with the burnt butter icecream mkr,0,1
3442,b' so now thor is a women captain america is now black and iron man is now superior silver wheredidmychildhoodgo …,0,1
3446,b'kat is a sociopath mkr,0,1
3447,b'can we set up a let andre escape from kat charity fund mkr,0,1
3455,b'no doubt and yet no less true,0,1
3467,b'mkr i actually liked ash tonight though she always looks like her hair is pulled back too tight,0,1
3468,b'your wit hath blinded me damn you made a page all about it daddy never loved you huh,0,1
3469,b' im not sexist but women drivers are bad and when i mean bad i mean bad,0,1
3471,b'and tells women that men are superior and that husbands can beat wives,0,1
3493,b'she does not give a shit what you think staggering this girl across from me has a jungle on each leg pleaseshave notsexist,0,1
3509,b' fuck im not sexist but i have a girl in my recruit school again son of a bitch,0,1
3516,b' scott walker should troll the left and get an online degree in gender studies,0,1
3518,b'men giving their opinions im not sexist but women playing poker,0,1
3536,b' no offence to anyone but women are poor drivers notsexist maybesexist,0,1
3538,b'i keep screengrabs not links sorry google kate millett sister now it should be near top of list,0,1
3542,b' think it is great funny world cup cameramen still get away with zooming in on smoking hot women during a game in not …,0,1
3544,b'i hate kate andrea mkr,0,1
3545,b'are you aware women have more not fewer legal rights than men,0,1
3550,b'just do not the sum total of your unconscious biases im not sexist but i just dont like female singers haha,0,1
3560,b' not sexist but i do not like it when girls are on sports talk shows,0,1
3564,b'fuck you kat mkr,0,1
3572,b'what a fucked up insult to mlk wow,0,1
3579,b'kats got the crazy eyes going on tonight mkr,0,1
3583,b' not sexist but female comedians are so shit,0,1
3584,b'catching up with mkr if society judges these two as pretty then i really have no friggin hope,0,1
3591,b' girls ca not catch ghosts fact notsexist justsaying ghostbusters,0,1
3595,b' patriarchy ™ will expel me if i divulge that i have a note saved i copy paste it like a nb httptco…,0,1
3603,b'def not sexist it is just not a good look in my opinion im definitely not sexist but i just feel like suits are more for men,0,1
3606,b'big difference between sassy and trashy sorry girls you could not even work a can opener mkr mykitchenrules,0,1
3608,b' first female sports now we have female refs and female announcers what has life come to notsexist,0,1
3612,b'gag i love females but i swear everyone someone comes close to hittin my car i look and it is a female notsexist,0,1
3614,b' the women are so much worse than the men at ski halfpipe truedat notsexist sochi winterolympics,0,1
3618,b' anyone else have to mute the tele when the woman commentator is on match of the day notsexist,0,1
3620,b'drasko only likes his mum is hot pot especially when she is drunk and unconscious mkr,0,1
3622,b' im not sexist in any way shape or form but the female presenters on sky sports news are soo prestigious,0,1
3624,b'rock is much closer to socrates than most know,0,1
3628,b'mmm bittersweet victory the models are toast but we still have kat and andre mkr,0,1
3630,b' call me sexist all you like love i was not the one driving at speed the wrong way around a very tight carpark with a …,0,1
3633,b'google financial abortion,0,1
3634,b'no idea what u said,0,1
