,Message,Racism,Sexism
6,"and it is muslims who were the first crusaders , attacking the christian world for centuries before it attacked back",1,0
7,capital hill is a great example of how seldom the world attacks islam given the daily provocations .,1,0
17,you are right . the violent murdering muslims are the only ones who understand the meaning of their religion .,1,0
36,i agree . he is just like the prophet mohammed .,1,0
40,hamas was elected once and have not had elections since.they have skipped many elections . mursi was going in same direction,1,0
59,"then you are a total idiot , because muslims are killing people around the globe . they are at war with every religion on earth",1,0
61,so we bombed hitler and various dictators because they refused to be slaves ? muslims need to get a grip on reality .,1,0
65,"labor tells raped girls to go home and not bother them , the filthy animals .",1,0
66,they are always hot air . but sometimes their hot air aligns with their prophets .,1,0
79,and of course the reason the majority now live in christian lands is muslim abuse .,1,0
88,rt : the kurds clean up the isis islamofascist trash in kobane . kobane is the graveyard of isis . via http://t.co/n…,1,0
92,the stupidist arguments are the ones rationalizing the barbarity of islam .,1,0
95,rt : #isis #islam pc puzzle : converting to a religion of peace leading to violence ? http://t.co/tbjusaemuh http://t.co/g4xoh…,1,0
97,lol . you think there are no probs for people who do not tow the main stream line in muslim c . http://t.co/yzdjhnfqen,1,0
99,terrorists that have taken the church over . she was born an american and so was never subject to ...,1,0
102,in fact blumenthal is palestinian friends behead gays .,1,0
106,islamophobia - fear of this . http://t.co/ky1nqpnlyb,1,0
108,"soon they will have to ask their uneducated , moronic madrassa rats to do surgery . a butcher knife and a prayer .",1,0
115,the us attacks terrorists and dictators . your religion opposes freedom and democracy . http://t.co/eqhyqleabg,1,0
126,rt : our doctrine supports terrorism & violence http://t.co/u3imwdacc0,1,0
130,wrong jewish tribe microbrain . the jews of khybar had nothing to do with mohammed .,1,0
131,rt : mt : #turkey is now the only major ( muslim majority ) country in the middle east that is not bombing #isis,1,0
135,it will be the same evil tentacles that are already there in a different uniform .,1,0
153,the poor women do it because they marry a muslim man and are pressured into it . men do it in prison . it is a criminal is relig,1,0
157,"all muslims share an ideology that is spelled out as bigoted , sexist , imperialists , homophobic .",1,0
171,"the difference is that islam has a requirement for jihad , has over 100 large terrorist orgs . , and declared war on world",1,0
176,"rt : after liberal atheist murders three muslim students who were members of anti-semitic , muslim bro … http://t.co/pntmamdq99 vi …",1,0
182,"for example , the literary style of the quran is always very literal . little use of metaphors , etc .",1,0
210,"if quran and hadith are full of hatred and murder and if muslims support sharia , then the problem is islam and screw leftists .",1,0
216,"since 90 % of muslim civilians are killed by muslim terrorists , you avatar is just propaganda .",1,0
236,so when are you going to admit that the quran is wrong . i'm waiting .,1,0
248,"you lie again . the quran and hadith do tell you to murder "" non believers "" http://t.co/dyxie27pbn",1,0
251,debunked what ignorant one . you are debunked by this . 8 hadith say she was six . http://t.co/4oq6gyknwb,1,0
256,and i do not care if the jews do what the have to do to protect themselves from the genocidal muslims .,1,0
260,this is what christians and other non muslims have had to deal with for 1400 years in the middle east .,1,0
262,of course muslim religious bigots like you think that is okay .,1,0
270,and do not talk to me about hatred when you follow the vulgar quran and hadiths that are full of hatred .,1,0
289,"so when the subject of islam is relationship with terrorism comes up , they react like the empty morons they are .",1,0
294,and here is the list of jewish nobel laureats . they contribute about 400 times as much as muslims . muslims contribute hate .,1,0
301,the people who were killed were supporters of the muslim brotherhood . young terrorists in the making .,1,0
326,and the truth is that more muslims are walking away from islam than people are converting to it . education will now kill #islam,1,0
338,any idiot lawyer could make the case that the quran should be outlawed on the basis of being hate speech .,1,0
339,rt : same msm that insists islam has no connection w / terror censors cartoons cuz they fear being murdered . s …,1,0
341,"hey , idiot ! you ca not use the problems of judaism to justify the barbarity of the quran .",1,0
362,salon tries to shut down free speech and shut people up by playing a race card about an ideaology . #islam,1,0
364,what an incredible piece of garbage . the muslims crusaded against the christians 400 years before christian crusades .,1,0
376,read the statistics microbrain . look at the percentage of the worlds muslims that want to kill apostates .,1,0
379,rt : the logic of islam reflects clearly in those who follow its ideology and oaths to be muhammad is slave . http://t.co/ciak7e9…,1,0
384,blacks have murdered far more whites than the reverse . your one sided presentation shows you are a racist .,1,0
386,just like there was 1400 years ago . the flies are free .,1,0
394,"1/3 of the religion is ready to murder apostates . there are no "" moderate muslims "" http://t.co/rhenxnvhbo",1,0
401,"the asshole prophet mohammed who was a slave trader , pedophile , murderer , war monger , sexist , bigot , caravan robber .",1,0
402,"i read the entire quran and many of the hadiths , and murdering "" unbelievers "" and forcing islam on people is exactly what it is .",1,0
420,they just produce islamolunatics . http://t.co/qxih8bd7nv,1,0
430,following example of their prophet muslims are still commonly marrying children . no one else is .,1,0
445,"rt : after the recent rape-murder case of a female turkish student , other turkish women are telling their stories to the worl …",1,0
450,thanks for showing again that blacks are the biggest racists . blocked,1,0
454,you are pandering to a religion that declared war on all humanity 1400 years ago .,1,0
470,max blumenthal is muslim friends busy raping christian girls around the world . http://t.co/liskp9u8uq,1,0
484,it is basically an empty excuse that leftists and muslims use for their anti us bigotry .,1,0
489,rt : ️ obama swindling future generations of americans adding 9 trillion dollars to debt 💰 #wakeupamerica http://t.co…,1,0
495,that is how muslims react when the traffic light turns red .,1,0
516,and for people who are not people of the book you guarantee them death or slavery .,1,0
524,forcing others to accept the barbarity of islam is actual obligation . http://t.co/d3ib1aqwrb,1,0
534,"the question is , how hard should we work to keep the muslims from killing each other , since they seem so determined to continue . #islam",1,0
536,the jews lived on 40 % of arabian peninsula before mohammed began genocide .,1,0
541,another barbaric aspect of islam is to murder people for the way they were born .,1,0
542,"all the lies they tell and the mantras they repeat about apartheid , etc . are all scripted propaganda and not spontaneous .",1,0
550,you only have to count the corpses to see that islamic extremism is widespread.jewish not,1,0
556,the parallel between the behavior of terrorist organizations and the prophet mohammed is something i have preached for 15 year,1,0
563,the daesh are getting too thin on manpower to hold all the fronts where they need to fight . bombing does have an effect .,1,0
564,allah scewed up when he planned on kobane . now the free citizens of kobane are rebuilding . http://t.co/0wcxczfu7m,1,0
572,"nope , blumenthal ignores the countless cases of muslim violence against minorities around the world , and instead ...",1,0
575,isis has slavery because the prophet mohammed was a slave owner and trader .,1,0
576,islam is full of incitements to murder unbelievers . what are you talking about ?,1,0
580,if you do not follow what is in the sunnah you do not follow what is in the sunnah . i could care less about your indignation .,1,0
586,"your prophet was a low life murdering , raping , robbing , bigoted , sexist , pedophile .",1,0
596,he says while immersed in kufiri invented and built devices .,1,0
626,"for example , in medina mohammed said , kindly cut off the heads of these 600 jewish men and enslave their women .",1,0
629,so why does not blumenthal go and ask hamas why they never have elections .,1,0
630,1/3 of all muslims believe that people who want to leave the religion should be murdered . http://t.co/mbtflxqk22,1,0
633,seems like being a muslim and living off a steady diet of conspiracy theories go together . islam is a religion of ignorance .,1,0
648,"no the muslims murdered the jews the traditional muslim way , with swords , knives , and spears . and they did it for 1400 years .",1,0
650,"the islam is the hate , microbrain . http://t.co/pwxcgc4cht",1,0
656,"why do 2/3 of all muslims want sharia , which demands death for homosexuals and apostates ? http://t.co/1je0s98wmh",1,0
661,and most muslims are actually better behaved than their religion leads them to be .,1,0
690,this is kiddie stuff compared to what muslims do every day . http://t.co/748sxvjf2u,1,0
693,"after watching the shia militia beat a peshmerga to death , i have concluded that they are animals , just like isis . #islam #iraq #kobane",1,0
706,exactly . merkel is defending this . and the protesters are called islamophobes for being against it . http://t.co/08zwrcto88,1,0
735,"peace ? you idiot , islam declared war on all humanity 1400 years ago . how can you blab on about peace . time to exterminate islam .",1,0
738,"already did . found out that islam is a vile , bigoted , hateful , murdering , sexist , slavery supporting cult .",1,0
746,nobody cares about your stupid rationalizations . we are simple going to kill all the daesh . hope you are one of em,1,0
748,why do these so called moderate muslims never ask themselves why islam has over 100 terrorist groups and no other religion is remotely close,1,0
764,islam declared war on all humanity 1400 years ago . and nothing has changed .,1,0
765,"i do not have a "" book "" . i have several hundred books . here is a couple that expose the vileness of islam . http://t.co/dnkmh61rl9",1,0
767,mohammed led 17 major military expeditions that killed tens of thousands . jesus led none .,1,0
768,"rt : many of the isis members are walking "" stoners "" ~ even #daesh #emwazi #jihadijohn it is been rumored he is high on #khat http …",1,0
771,"yeah , being anti zionist is pretending to have an excuse for being anti semitic .",1,0
773,no they do not they share a commitment to the barbarity of their religion . http://t.co/kpjse079al,1,0
785,"why do isis , the saudis and the taliban imprison women in their homes ? because the quran tells them to . #islam #iraq http://t.co/dm64qjbkmj",1,0
786,for the last 1000 years islam has contributed nothing to mankind but murder . http://t.co/h8a8jkfudo,1,0
798,why should you be annoyed at being denied rights that you do not give to others . you are a hypocrite .,1,0
804,"fighting along side anyone in the me makes you someone else is enemy , regardless of the motivation . their problem , not ours .",1,0
807,wrong . they were connected to the muslim brotherhood and they were anti semitic bigots .,1,0
817,what do customs and rules and history have to do with it . marrying a 6 year old and screwing a 9 year old is sick like islam .,1,0
828,of course the old leach mohammed gave himself permission to screw pretty much whatever he liked . http://t.co/ctthez7xus,1,0
830,"if you like it or not , islam declared war on all humanity in the quran 1400 years ago .",1,0
831,do not be an idiot . there are more than 100 muslim terrorist organizations . no other religion has anything close .,1,0
834,"no , the money comes from muslims around the world who want a caliphate and the domination of islam by force .",1,0
840,every border that islam has with every other religion and non religion is bloody .,1,0
845,you have no say on what freedom of expression extends to . everyone should be insulting the phony pedophile prophet .,1,0
848,thanks for admitting that you are murderers . and check your map . http://t.co/theary220e,1,0
853,roflmao . where is the picture daeshbag ?,1,0
854,leave it to some microbrain to get sanctimonious by finding a way to play the race card .,1,0
856,"no , microbrain , i'm okay with israel doing what they have to do to stop the same extermination the muslims have done for 1400 yrs .",1,0
866,"look at the data dipwad , 2/3 want sharia law , which denies all rights to women and non muslims . http://t.co/7qupimban7",1,0
869,"given that islam declared war on all humanity 1400 years ago , why should we not burn down all mosques ?",1,0
874,"and of course the palestinians are firing rockets at israel without any regard for what they hit , including women and children .",1,0
899,there are 1.5 billion muslims idiot . for the size of their population they contribute virtually nothing .,1,0
901,kiss my ass . i do not read books by muslim bigots written to promote their fascist murdering genocide of humanity .,1,0
908,"mostly old testament , were its heroes attacked and slaughter every man , woman , child , animal",1,0
910,europe needs to expel their muslim immigrants .,1,0
922,"since muslims do not speak out against their terrorists , why should we ? http://t.co/95y5hlyp1c",1,0
936,they will all have no skills except jihad .,1,0
941,wheras the arabs really are behaving people and you scum are ignoring it .,1,0
951,"again , you miss the point that god is not interested in military rule , phony frauds like mohammed who benefit from it are #islam",1,0
962,"but it is a lie . the religion is a disgusting , terrorist , hate mongering piece of filth . that has nothing to do with individuals .",1,0
964,what matters is that people like you are trying to lay a guilt trip on us while ignoring the truth .,1,0
967,max is palestinian muslim friends throw an atheist blogger into prison for 10 months for his religious views .,1,0
971,"rt : there angry over cartoons but not beheadings , people being burnt alive , or …",1,0
983,"rt : at least now muslims have been exposed-they protest against free speech but do not for 7/7 , lee rigby , isis or rotherham …",1,0
988,that is when a 53 year old man marries a 6 year old girl and screws her when she is 9 like mohammed .,1,0
995,"i am better . i have no problem with hinduism , christianity , tao , judaism , buddhism or atheism . but islam hates all non-muslims .",1,0
1013,i do not care if they are shia islamolunatics or sunni islamolunatics . the are all filth to me .,1,0
1014,rt : http://t.co/m8n6emk2u2 8 - year-old yemeni child dies at hands of 40 - year-old husband on wedding night . this is sharia h …,1,0
1019,i just told you that women owned property before islam . had nothing to do with islam . islam is sexist to the very core .,1,0
1021,"mohammed was a murderer , jesus was not . mohammed was a rapist , jesus was not .",1,0
1026,the logic of a retarded madrassa rat .,1,0
1030,mohammed is first wife katjia was a wealthy woman before islam . so you are lying .,1,0
1031,"mohammed always lied , saying he had to attack because others planned to attack him .",1,0
1037,the prophet mohammed was a big murderer . he once beheaded 600 jews in one day . isis does what he did .,1,0
1041,"your friends are the palestinians who cut off gays heads , do honor killings , force sharia .",1,0
1065,by choosing to be muslims they have chosen to be haters of non muslims . http://t.co/mta5tuxtw6,1,0
1070,come back for a chat when you get a brain .,1,0
1072,if a raped woman does not have four witnesses she will be punished further under islam .,1,0
1073,"rt : "" muslim americans feel they have been targeted ” - obama no mention of jews , victims 60 % of the time ( h / t ) http : …",1,0
1079,rt : austrians say islam does not belong in their nation : poll http://t.co/pa7ytfbqhb …,1,0
1082,who knows if they criticized him ? he killed them . and the things against him would never make it into the sunnah .,1,0
1085,they are occupied because arab muslims want jews exterminated . https://t.co/8cmfoozwxz,1,0
1093,"our politicians make inane speeches about freedom of speech while studiously avoiding the real source of the problem , the violence in #islam",1,0
1098,"rt : it is a calculated arab policy , to keep the palestinians in a state of desperation to incite more …",1,0
1103,now the muslim arabs are using the palestinans as their spear point to complete the extermination .,1,0
1128,the later verses abrogated the earlier verses and what remains is violent and imperialist .,1,0
1129,really ? do not you know anything about your evil religion ? http://t.co/c0ode7cc76,1,0
1138,"most people who become muslims are either forced or pressured into it , and the children have no choice .",1,0
1140,"what do you care , scumbag ? you murder and enslave unarmed ezidi and christian civilians .",1,0
1153,"no , the muslims worldwide are the problem . israel is protecting itself against the same muslim persecution that is global .",1,0
1170,it is unbelievable the way that journalists fall all over themselves to make excuses for the barbarity of islam . not one has read the quran .,1,0
1181,funny how defenders of islam like to bring up the crusades . but the muslim crusaders were attacking christianity first .,1,0
1183,all of you islamists repeat the same brain dead lines that someone else told you to say . i have seen that one a thousand times .,1,0
1202,and the christian world got rid of slavery by itself.the muslim world was pressured into getting rid of it and now returns to it,1,0
1203,"no , that was just your pedophile prophet making excuses to slaughter them and steal their land and property .",1,0
1209,what is to understand . the daesh have passed a law that people cannot leave raqqa or mosul because they are sewers of terror .,1,0
1219,arabs and muslims against the jews . https://t.co/8cmfoozwxz,1,0
1225,pieces of shit like you are doing everything in your power to exterminate white people .,1,0
1227,"self genociadal , self serving liars .",1,0
1234,"lol . the me was very creative before islam . most "" muslim "" discoveries came from conquered persians .",1,0
1238,if the islamofascist lunatics stopped attacking israel there would be peace .,1,0
1249,isis wants to control the world because mohammed wanted to control it .,1,0
1252,if you walked down saudi street dressed like in yr picture would be arrested .,1,0
1258,"hopefully the followers of the slave trader , and pedophile prophet , mohammed .",1,0
1261,"islam declared war on all mankind 1400 years ago , now muslims cry like babies when others respond in kind .",1,0
1265,"yeah , i read that . and every verse of the tao te ching is superior to every verse of the quran . so quran is fraud .",1,0
1273,because islam has over 100 operating terrorist groups and a mandate to conquer the world by violence .,1,0
1280,rt : http://t.co/agx6dizuih england and wales child rape cases up 37 % in five years we all know why,1,0
1286,i'm not concerned with single events . i'm concerned with 1400 years of islamic murder and barbarity that shows no sign of ending .,1,0
1295,i do not trust isis or the shia militia . both want to force their sick religion on people . #tikrit,1,0
1299,1400 years ago the pedophile prophet declared war on all humanity . so all humanity should hate islam .,1,0
1304,""" mainstream "" muslims are also radicals . http://t.co/x5gsyw8pgb",1,0
1308,rt : giuliani watched his city attacked & people jump to their deaths . he is entitled to say wtf he wants about the guy shield …,1,0
1332,rt : rt @unpoliticalprty : the true history of #islam and slavery must see http://t.co/ufjt3iazzw #pjnet,1,0
1356,"scum bag islamists evacuated all the christian and ezidi civilians from their homes in mosul , raqqa , sinjar .",1,0
1361,"you have to be an idiot to think that you can follow an ideology of murder , imperialism , hatred and have people like you for it",1,0
1368,"wrong again , it is the muslims murdering the hindus in india , kashmir , bangladesh , and pakistan .",1,0
1371,that is like saying that my freedom is limited if i'm not allowed to kill you .,1,0
1379,rt : obama and his love for golf is greater that love for christians or jews ! http://t.co/lludcu5jsp,1,0
1387,i pray that the lying criminal bitch goes to prison .,1,0
1396,daesh price list for yezidi and christian sex slaves . http://t.co/h4elrfxhsm,1,0
1402,"when people leave islam , they do not announce it . they just quietly walk away .",1,0
1405,nothing has any value for arabs except the destruction of the jews . and the arabs must pay palestine to destroy em,1,0
1417,"isis is a giant embarrassment to muslims , not just because of the barbaric things they do . but because ...",1,0
1418,"the muslim mobs of bangladesh attack hindus , destroying thousands of homes and temples . http://t.co/inlik2tlcp",1,0
1424,"rt : authorities will use anti semitic attacks on twitter by muslims and the left to introduce laws against hate speech , re …",1,0
1425,and you are supporting the little head choppers and honor killers in palestine .,1,0
1430,like the ottoman empire was a pure slave state .,1,0
1445,"rt : this is well-written & worth reading on daily life in mosul today "" caliphatalism ? "" http://t.co/ibnjkumhwk via",1,0
1452,do you think the yokels at salon know that mohammed was a slave trader who owned 28 slaves ? not a chance . #islam,1,0
1454,maybe you should teach that respect to the muslim hate mobs who murder christians and hindus for pretended blaspemy .,1,0
1470,just because i have no religion does't mean that i do not want to stop islam from murdering . http://t.co/9kte08yrfk,1,0
1478,really ? what are they doing that your prophet did not also do ? http://t.co/fasawdislh,1,0
1479,ask the muslims . they are the ones killing all the jews .,1,0
1505,and the muslim students hadith database shows ashia was 6 when the pedo mohammed married her .,1,0
1509,rt : my point is that mohammeds example us used by some muslim men to justify their paedophilia . http://t.co/rwy…,1,0
1537,fuck these people that want to steal our freedom of speech for the sake of a fascist religious ideology .,1,0
1538,"yes , only islam can generate that level of barbarity , hatred , and inhumanity . https://t.co/frohluet12",1,0
1555,countryside will be easy to take . mosul and raqqa will be difficult because the daesh will hid behind civilians,1,0
1567,"the woman wearing the bikini can wear it or she can cover everything , her choice . if she makes that choice in islam she is beaten",1,0
1578,who cares who defined it . the muslims lived off the production of the jews and left them impoverished .,1,0
1583,this is political opinion . the truth is that islam is itself radical and we must outlaw it .,1,0
1589,up your ass terrorist bitch .,1,0
1593,"and celebratory shouts of "" fuck allah "" could be heard all over the us . now daesh pussies will fight real soldiers .",1,0
1600,"rt : sir winston churchhill : "" islam is a dangerous in a man as rabies in a dog "" http://t.co/kcxgkd70sk",1,0
1637,hamaz never stopped it is war on israel . islam never stopped it is war on humanity .,1,0
1649,"no asshole , i single out muslims because their barbarity is set in stone in the quran and they have not and cannot evolve .",1,0
1659,balance what ? the hate cult of islam has zero place in american schools .,1,0
1661,rt : please draw mohammed ! just a smiley face will do but draw it and post it . #iamcharliehebdo http://t.co/qiovzynxdj,1,0
1666,where the muslims followed the example of mohammed and continued to murder them .,1,0
1678,why is isis obsessed with beheadings ? because their terrorist prophet mohammed had 600 men beheaded in one day . #islam http://t.co/zkqzuyyhjs,1,0
1686,"mohammed raped slave girls , the quran approves of the rape of slave girls - so isis rapes , slave girls .",1,0
1690,all you are doing with your verses is proving sexism in islam .,1,0
1693,dodge rambles on making assertion after assertion with zero evidence and no references in quran or hadith . it is garbage,1,0
1698,"how long before some idiot politician tells us that this is not about islam , but about some islamic extremist ? #copenhagen",1,0
1702,the me led the world in development before there was islam and fell behind the world after islam .,1,0
1706,"poor daesh . now they ca not rape her , torture her , or make an execution video of her .",1,0
1725,objecting to this is what the pc morons of salon call racism . http://t.co/zju8nqchif,1,0
1739,the prophet mohammed declared war on all non muslims 1400 years ago exactly to impose such .,1,0
1745,true . stoning and beheading were much more to mohammed is taste .,1,0
1751,rt : norway sees huge drop crime as large number muslim illegals deported http://t.co/6vbvvpwn1q …,1,0
1754,a . their bodies are far from finishing growth . b . their minds are far from finishing growth .,1,0
1799,i hear all kinds of people say that jews control the agenda and the media .,1,0
1811,the saudis will arm sunni rebels in yemen . civil war is inevitable .,1,0
1812,b . the only reason there are non muslims on the earth is because the non muslim armies defeated the muslims .,1,0
